{
  "$schema": "http://json-schema.org/draft-07/schema#",
  "$id": "schema/iap.schema.json",
  "title": "In-app purchases",
  "description": "Shape contract for shared/data/iap.json. Generated by tools/studio/gen-schemas.mjs — edit the generator, not this file.",
  "type": "object",
  "required": [
    "emberValueTableBRL",
    "ethics",
    "products",
    "receiptValidation",
    "version"
  ],
  "additionalProperties": false,
  "properties": {
    "$schema": {
      "type": "string"
    },
    "_comment": {
      "type": "string"
    },
    "emberValueTableBRL": {
      "type": "array",
      "items": {
        "type": "object",
        "properties": {
          "brl": {
            "type": "number"
          },
          "embers": {
            "type": "integer"
          },
          "productId": {
            "type": "string"
          }
        },
        "required": [
          "brl",
          "embers",
          "productId"
        ]
      }
    },
    "ethics": {
      "type": "object",
      "properties": {
        "confirmBeforePurchase": {
          "type": "boolean"
        },
        "noDarkPatterns": {
          "type": "boolean"
        },
        "noDisguisedAds": {
          "type": "boolean"
        },
        "noFakeScarcity": {
          "type": "boolean"
        },
        "purchaseCooldownAfterAnyPurchaseHours": {
          "type": "integer"
        },
        "restoreAlwaysAvailable": {
          "type": "boolean"
        },
        "showRealPrice": {
          "type": "boolean"
        },
        "starterPackShownAfterFirstUpgrade": {
          "type": "boolean"
        },
        "starterPackShownAfterTurns": {
          "type": "integer"
        }
      },
      "required": [
        "confirmBeforePurchase",
        "noDarkPatterns",
        "noDisguisedAds",
        "noFakeScarcity",
        "purchaseCooldownAfterAnyPurchaseHours",
        "restoreAlwaysAvailable",
        "showRealPrice",
        "starterPackShownAfterFirstUpgrade",
        "starterPackShownAfterTurns"
      ]
    },
    "products": {
      "type": "array",
      "items": {
        "type": "object",
        "properties": {
          "analyticsTier": {
            "type": "string"
          },
          "contents": {
            "type": "array",
            "items": {
              "type": "object",
              "properties": {
                "amount": {
                  "type": "integer"
                },
                "currency": {
                  "enum": [
                    "coins",
                    "embers"
                  ]
                },
                "id": {
                  "type": "string",
                  "pattern": "^[a-z][a-z0-9_]*$"
                },
                "type": {
                  "type": "string"
                }
              }
            }
          },
          "descKey": {
            "type": "string"
          },
          "id": {
            "type": "string",
            "pattern": "^[a-z][a-z0-9_]*(\\.[a-z0-9]+)+$"
          },
          "nameKey": {
            "type": "string"
          },
          "oneTimePerAccount": {
            "type": "boolean"
          },
          "suggestedPriceBRL": {
            "type": "number"
          },
          "type": {
            "type": "string"
          }
        },
        "required": [
          "analyticsTier",
          "contents",
          "descKey",
          "id",
          "nameKey",
          "suggestedPriceBRL",
          "type"
        ]
      }
    },
    "receiptValidation": {
      "type": "object",
      "properties": {
        "fallback": {
          "type": "string"
        },
        "gracefulOffline": {
          "type": "string"
        },
        "mode": {
          "type": "string"
        },
        "retryPolicy": {
          "type": "object",
          "properties": {
            "attempts": {
              "type": "integer"
            },
            "backoffMs": {
              "type": "array",
              "items": {
                "type": "integer"
              }
            }
          },
          "required": [
            "attempts",
            "backoffMs"
          ]
        },
        "serverSideVerification": {
          "type": "string"
        }
      },
      "required": [
        "fallback",
        "gracefulOffline",
        "mode",
        "retryPolicy",
        "serverSideVerification"
      ]
    },
    "version": {
      "type": "integer"
    }
  }
}
